{
    "schema": "ark.workbench-test-contract.v1",
    "contract_version": "1.0.0",
    "module": {
        "id": "project-audit-ledger",
        "version": "1.0.0",
        "application_profile": "ark.workbench"
    },
    "ownership": {
        "routes": {
            "GET": [
                "/admin/project-audit-ledger",
                "/admin/project-audit-ledger/approvals",
                "/admin/project-audit-ledger/attachments/{id}/download",
                "/admin/project-audit-ledger/audit",
                "/admin/project-audit-ledger/audit-trail",
                "/admin/project-audit-ledger/bom",
                "/admin/project-audit-ledger/cash-advances",
                "/admin/project-audit-ledger/cash-advances/create",
                "/admin/project-audit-ledger/clients",
                "/admin/project-audit-ledger/clients/create",
                "/admin/project-audit-ledger/clients/{id}",
                "/admin/project-audit-ledger/clients/{id}/edit",
                "/admin/project-audit-ledger/collections",
                "/admin/project-audit-ledger/collections/create",
                "/admin/project-audit-ledger/collections/{id}",
                "/admin/project-audit-ledger/expenses",
                "/admin/project-audit-ledger/expenses/create",
                "/admin/project-audit-ledger/expenses/{id}",
                "/admin/project-audit-ledger/expenses/{id}/edit",
                "/admin/project-audit-ledger/fabrication",
                "/admin/project-audit-ledger/fabrication/allocations",
                "/admin/project-audit-ledger/fabrication/payments",
                "/admin/project-audit-ledger/fabrication/payments/create",
                "/admin/project-audit-ledger/fabrication/{projectId}/dues",
                "/admin/project-audit-ledger/inventory",
                "/admin/project-audit-ledger/inventory/movements",
                "/admin/project-audit-ledger/inventory/{id}",
                "/admin/project-audit-ledger/issuances",
                "/admin/project-audit-ledger/issuances/create",
                "/admin/project-audit-ledger/issuances/returns",
                "/admin/project-audit-ledger/material-issuance",
                "/admin/project-audit-ledger/material-issuance/create",
                "/admin/project-audit-ledger/material-issuance/{id}",
                "/admin/project-audit-ledger/material-issuance/{id}/edit",
                "/admin/project-audit-ledger/material-returns",
                "/admin/project-audit-ledger/material-returns/create",
                "/admin/project-audit-ledger/mobilization",
                "/admin/project-audit-ledger/projects",
                "/admin/project-audit-ledger/projects/create",
                "/admin/project-audit-ledger/projects/{id}",
                "/admin/project-audit-ledger/projects/{id}/edit",
                "/admin/project-audit-ledger/purchases",
                "/admin/project-audit-ledger/purchases/create",
                "/admin/project-audit-ledger/purchases/{id}",
                "/admin/project-audit-ledger/purchases/{id}/edit",
                "/admin/project-audit-ledger/quotations",
                "/admin/project-audit-ledger/quotations/create",
                "/admin/project-audit-ledger/quotations/{id}",
                "/admin/project-audit-ledger/quotations/{id}/edit",
                "/admin/project-audit-ledger/reports",
                "/admin/project-audit-ledger/sales",
                "/admin/project-audit-ledger/sales/create",
                "/admin/project-audit-ledger/sales/{id}",
                "/admin/project-audit-ledger/sales/{id}/edit",
                "/admin/project-audit-ledger/sales/{id}/print",
                "/admin/project-audit-ledger/settings",
                "/admin/project-audit-ledger/suppliers",
                "/admin/project-audit-ledger/suppliers/create",
                "/admin/project-audit-ledger/suppliers/{id}/edit",
                "/admin/project-audit-ledger/team-lead",
                "/admin/project-audit-ledger/team-lead/attendance",
                "/admin/project-audit-ledger/team-lead/cash-advances",
                "/admin/project-audit-ledger/team-lead/cash-advances/create",
                "/admin/project-audit-ledger/team-lead/fabrication",
                "/admin/project-audit-ledger/team-lead/mobilization",
                "/admin/project-audit-ledger/team-lead/mobilization/create",
                "/admin/project-audit-ledger/users",
                "/api/v1/project-audit-ledger/auth/logout",
                "/api/v1/project-audit-ledger/bom/export",
                "/api/v1/project-audit-ledger/projects",
                "/api/v1/project-audit-ledger/projects/{id}/cost",
                "/api/v1/project-audit-ledger/projects/{id}/items",
                "/project-audit-ledger/forgot-password",
                "/project-audit-ledger/login",
                "/project-audit-ledger/logout",
                "/project-audit-ledger/reset-password",
                "/project-audit-ledger/team-lead/login",
                "/project-audit-ledger/team-lead/verify"
            ],
            "POST": [
                "/api/v1/project-audit-ledger/approvals/{id}/decide",
                "/api/v1/project-audit-ledger/attachments",
                "/api/v1/project-audit-ledger/attachments/list",
                "/api/v1/project-audit-ledger/attachments/{id}/delete",
                "/api/v1/project-audit-ledger/auth/forgot-password",
                "/api/v1/project-audit-ledger/auth/login",
                "/api/v1/project-audit-ledger/auth/logout",
                "/api/v1/project-audit-ledger/auth/reset-password",
                "/api/v1/project-audit-ledger/autocomplete",
                "/api/v1/project-audit-ledger/bom/export",
                "/api/v1/project-audit-ledger/cash-advances",
                "/api/v1/project-audit-ledger/cash-advances/{id}/approve",
                "/api/v1/project-audit-ledger/cash-advances/{id}/settle",
                "/api/v1/project-audit-ledger/cash-advances/{id}/void",
                "/api/v1/project-audit-ledger/clients",
                "/api/v1/project-audit-ledger/clients/{id}",
                "/api/v1/project-audit-ledger/collections",
                "/api/v1/project-audit-ledger/collections/generate",
                "/api/v1/project-audit-ledger/collections/{id}/status",
                "/api/v1/project-audit-ledger/expenses",
                "/api/v1/project-audit-ledger/expenses/{id}",
                "/api/v1/project-audit-ledger/expenses/{id}/submit",
                "/api/v1/project-audit-ledger/fabrication/allocations",
                "/api/v1/project-audit-ledger/fabrication/allocations/{id}",
                "/api/v1/project-audit-ledger/fabrication/dues",
                "/api/v1/project-audit-ledger/fabrication/payments",
                "/api/v1/project-audit-ledger/inventory/adjust",
                "/api/v1/project-audit-ledger/issuances",
                "/api/v1/project-audit-ledger/issuances/{id}",
                "/api/v1/project-audit-ledger/issuances/{id}/submit",
                "/api/v1/project-audit-ledger/materials",
                "/api/v1/project-audit-ledger/materials/return",
                "/api/v1/project-audit-ledger/mobilization/{id}/approve",
                "/api/v1/project-audit-ledger/mobilization/{id}/disburse",
                "/api/v1/project-audit-ledger/mobilization/{id}/reject",
                "/api/v1/project-audit-ledger/projects",
                "/api/v1/project-audit-ledger/projects/{id}",
                "/api/v1/project-audit-ledger/projects/{id}/email",
                "/api/v1/project-audit-ledger/projects/{id}/status",
                "/api/v1/project-audit-ledger/purchases",
                "/api/v1/project-audit-ledger/purchases/{id}",
                "/api/v1/project-audit-ledger/purchases/{id}/submit",
                "/api/v1/project-audit-ledger/quick-create",
                "/api/v1/project-audit-ledger/quotations",
                "/api/v1/project-audit-ledger/quotations/{id}",
                "/api/v1/project-audit-ledger/quotations/{id}/convert",
                "/api/v1/project-audit-ledger/quotations/{id}/convert-project",
                "/api/v1/project-audit-ledger/quotations/{id}/status",
                "/api/v1/project-audit-ledger/reports/generate",
                "/api/v1/project-audit-ledger/sales",
                "/api/v1/project-audit-ledger/sales/{id}",
                "/api/v1/project-audit-ledger/sales/{id}/email",
                "/api/v1/project-audit-ledger/settings",
                "/api/v1/project-audit-ledger/settings/categories",
                "/api/v1/project-audit-ledger/settings/materials/{id}",
                "/api/v1/project-audit-ledger/settings/suppliers",
                "/api/v1/project-audit-ledger/settings/toggle/{id}",
                "/api/v1/project-audit-ledger/suppliers",
                "/api/v1/project-audit-ledger/suppliers/{id}",
                "/api/v1/project-audit-ledger/tl/cash-advances",
                "/api/v1/project-audit-ledger/tl/logout",
                "/api/v1/project-audit-ledger/tl/mobilization",
                "/api/v1/project-audit-ledger/tl/otp-request",
                "/api/v1/project-audit-ledger/tl/otp-resend",
                "/api/v1/project-audit-ledger/tl/otp-verify",
                "/api/v1/project-audit-ledger/users",
                "/api/v1/project-audit-ledger/users/{id}",
                "/api/v1/project-audit-ledger/users/{id}/delete",
                "/project-audit-ledger/auth/login",
                "/project-audit-ledger/logout"
            ],
            "PUT": [],
            "PATCH": [],
            "DELETE": []
        },
        "navigation_dependencies": [],
        "tables": [
            "pal_users",
            "pal_password_resets",
            "pal_projects",
            "pal_project_items",